{
  "schema_version": "1.0",
  "algorithm": "ed25519",
  "receipt": {
    "approval_id": "APP-EXACT-OPERATION-001",
    "operation_id": "PROD-OPERATION-001",
    "operation_payload": {
      "repository": "replace-with-repository-identity",
      "project": "replace-with-project-identity",
      "environment": "replace-with-exact-environment",
      "scope": "replace-with-one-exact-operation-scope",
      "category": "high_risk_operation",
      "target": "replace-with-exact-operation-target",
      "parameters": {"mode": "replace-with-non-secret-exact-parameter"},
      "effects": {"production": true}
    },
    "summary": "One exact high-risk operation",
    "scope": "replace-with-one-exact-operation-scope",
    "approved_by": "replace-with-owner-id",
    "issued_at": "REPLACE_WITH_CURRENT_TIME_RFC3339",
    "expires_at": "REPLACE_WITH_EXPIRY_TIME_RFC3339",
    "nonce": "replace-with-unique-random-nonce"
  },
  "signature": "replace-with-base64-ed25519-signature"
}
